<!ELEMENT KeyBindings (Global, Player1, Player2)>
<!ELEMENT Global (Bind?)>
<!ELEMENT Player1 (Bind*)>
<!ELEMENT Player2 (Bind*)>
<!ELEMENT Bind EMPTY>
<!ATTLIST Bind
	action CDATA #REQUIRED
	keyCode CDATA #REQUIRED
>